{
 "kind": "analysis_result_set",
 "schema_version": "1.0",
 "units": {
  "system": "consistent_user_defined",
  "length": "unspecified",
  "force": "unspecified",
  "mass": "unspecified",
  "time": "unspecified"
 },
 "coordinate_system": {
  "name": "global_cartesian",
  "handedness": "right",
  "axes": [
   "x",
   "y",
   "z"
  ]
 },
 "cases": [
  {
   "case_id": "1",
   "name": "線路方向_Case1",
   "symbol": "1",
   "analysis_type": "material_nonlinear",
   "support_node_ids": [
    "9"
   ]
  }
 ],
 "topology": {
  "nodes": [
   {
    "node_id": "1",
    "coordinates": {
     "x": 0.69,
     "y": -10.5,
     "z": 0.0
    },
    "source_node_id": "1",
    "generated": false
   },
   {
    "node_id": "2",
    "coordinates": {
     "x": 0.0,
     "y": -9.1,
     "z": 0.0
    },
    "source_node_id": "2",
    "generated": false
   },
   {
    "node_id": "3",
    "coordinates": {
     "x": 0.69,
     "y": -9.1,
     "z": 0.0
    },
    "source_node_id": "3",
    "generated": false
   },
   {
    "node_id": "4",
    "coordinates": {
     "x": 0.0,
     "y": -8.6,
     "z": 0.0
    },
    "source_node_id": "4",
    "generated": false
   },
   {
    "node_id": "5",
    "coordinates": {
     "x": 0.0,
     "y": -5.95,
     "z": 0.0
    },
    "source_node_id": "5",
    "generated": false
   },
   {
    "node_id": "6",
    "coordinates": {
     "x": 0.0,
     "y": -0.01,
     "z": 0.0
    },
    "source_node_id": "6",
    "generated": false
   },
   {
    "node_id": "7",
    "coordinates": {
     "x": 0.0,
     "y": 0.0,
     "z": 0.0
    },
    "source_node_id": "7",
    "generated": false
   },
   {
    "node_id": "8",
    "coordinates": {
     "x": 0.0,
     "y": 1.0,
     "z": 0.0
    },
    "source_node_id": "8",
    "generated": false
   },
   {
    "node_id": "9",
    "coordinates": {
     "x": 0.0,
     "y": 2.0,
     "z": 0.0
    },
    "source_node_id": "9",
    "generated": false
   }
  ],
  "members": [
   {
    "member_id": "1",
    "node_i": "1",
    "node_j": "3",
    "local_frame": {
     "origin": {
      "x": 0.69,
      "y": -10.5,
      "z": 0.0
     },
     "x_axis": {
      "x": 0.0,
      "y": 1.0,
      "z": 0.0
     },
     "y_axis": {
      "x": -1.0,
      "y": 0.0,
      "z": 0.0
     },
     "z_axis": {
      "x": 0.0,
      "y": 0.0,
      "z": 1.0
     }
    },
    "stations": [
     {
      "station_id": "S0",
      "position": 0.0
     },
     {
      "station_id": "S1",
      "position": 1.4000000000000004
     }
    ]
   },
   {
    "member_id": "2",
    "node_i": "2",
    "node_j": "3",
    "local_frame": {
     "origin": {
      "x": 0.0,
      "y": -9.1,
      "z": 0.0
     },
     "x_axis": {
      "x": 1.0,
      "y": 0.0,
      "z": 0.0
     },
     "y_axis": {
      "x": 0.0,
      "y": 1.0,
      "z": 0.0
     },
     "z_axis": {
      "x": 0.0,
      "y": 0.0,
      "z": 1.0
     }
    },
    "stations": [
     {
      "station_id": "S0",
      "position": 0.0
     },
     {
      "station_id": "S1",
      "position": 0.69
     }
    ]
   },
   {
    "member_id": "3",
    "node_i": "2",
    "node_j": "4",
    "local_frame": {
     "origin": {
      "x": 0.0,
      "y": -9.1,
      "z": 0.0
     },
     "x_axis": {
      "x": 0.0,
      "y": 1.0,
      "z": 0.0
     },
     "y_axis": {
      "x": -1.0,
      "y": 0.0,
      "z": 0.0
     },
     "z_axis": {
      "x": 0.0,
      "y": 0.0,
      "z": 1.0
     }
    },
    "stations": [
     {
      "station_id": "S0",
      "position": 0.0
     },
     {
      "station_id": "S1",
      "position": 0.5
     }
    ]
   },
   {
    "member_id": "4",
    "node_i": "4",
    "node_j": "5",
    "local_frame": {
     "origin": {
      "x": 0.0,
      "y": -8.6,
      "z": 0.0
     },
     "x_axis": {
      "x": 0.0,
      "y": 1.0,
      "z": 0.0
     },
     "y_axis": {
      "x": -1.0,
      "y": 0.0,
      "z": 0.0
     },
     "z_axis": {
      "x": 0.0,
      "y": 0.0,
      "z": 1.0
     }
    },
    "stations": [
     {
      "station_id": "S0",
      "position": 0.0
     },
     {
      "station_id": "S1",
      "position": 2.6499999999999995
     }
    ]
   },
   {
    "member_id": "5",
    "node_i": "5",
    "node_j": "6",
    "local_frame": {
     "origin": {
      "x": 0.0,
      "y": -5.95,
      "z": 0.0
     },
     "x_axis": {
      "x": 0.0,
      "y": 1.0,
      "z": 0.0
     },
     "y_axis": {
      "x": -1.0,
      "y": 0.0,
      "z": 0.0
     },
     "z_axis": {
      "x": 0.0,
      "y": 0.0,
      "z": 1.0
     }
    },
    "stations": [
     {
      "station_id": "S0",
      "position": 0.0
     },
     {
      "station_id": "S1",
      "position": 5.94
     }
    ]
   },
   {
    "member_id": "6",
    "node_i": "6",
    "node_j": "7",
    "local_frame": {
     "origin": {
      "x": 0.0,
      "y": -0.01,
      "z": 0.0
     },
     "x_axis": {
      "x": 0.0,
      "y": 1.0,
      "z": 0.0
     },
     "y_axis": {
      "x": -1.0,
      "y": 0.0,
      "z": 0.0
     },
     "z_axis": {
      "x": 0.0,
      "y": 0.0,
      "z": 1.0
     }
    },
    "stations": [
     {
      "station_id": "S0",
      "position": 0.0
     },
     {
      "station_id": "S1",
      "position": 0.01
     }
    ]
   },
   {
    "member_id": "7",
    "node_i": "7",
    "node_j": "8",
    "local_frame": {
     "origin": {
      "x": 0.0,
      "y": 0.0,
      "z": 0.0
     },
     "x_axis": {
      "x": 0.0,
      "y": 1.0,
      "z": 0.0
     },
     "y_axis": {
      "x": -1.0,
      "y": 0.0,
      "z": 0.0
     },
     "z_axis": {
      "x": 0.0,
      "y": 0.0,
      "z": 1.0
     }
    },
    "stations": [
     {
      "station_id": "S0",
      "position": 0.0
     },
     {
      "station_id": "S1",
      "position": 1.0
     }
    ]
   },
   {
    "member_id": "8",
    "node_i": "8",
    "node_j": "9",
    "local_frame": {
     "origin": {
      "x": 0.0,
      "y": 1.0,
      "z": 0.0
     },
     "x_axis": {
      "x": 0.0,
      "y": 1.0,
      "z": 0.0
     },
     "y_axis": {
      "x": -1.0,
      "y": 0.0,
      "z": 0.0
     },
     "z_axis": {
      "x": 0.0,
      "y": 0.0,
      "z": 1.0
     }
    },
    "stations": [
     {
      "station_id": "S0",
      "position": 0.0
     },
     {
      "station_id": "S1",
      "position": 1.0
     }
    ]
   }
  ],
  "shell_elements": [],
  "solid_elements": []
 },
 "results": [
  {
   "case_id": "1",
   "state": {
    "kind": "load_step",
    "index": 0,
    "load_factor": 0.0,
    "is_final": false
   },
   "node_displacements": [
    {
     "node_id": "1",
     "components": {
      "dx": 0.0022305761995140404,
      "dy": 0.002601902681061621,
      "dz": 0.0,
      "rx": 0.0,
      "ry": 0.0,
      "rz": 0.0001818136679013731
     }
    },
    {
     "node_id": "2",
     "components": {
      "dx": 0.0019760690516521183,
      "dy": 0.0024760961136376346,
      "dz": 0.0,
      "rx": 0.0,
      "ry": 0.0,
      "rz": 0.0001816701755015411
     }
    },
    {
     "node_id": "3",
     "components": {
      "dx": 0.0019760690516521183,
      "dy": 0.0026014909310936207,
      "dz": 0.0,
      "rx": 0.0,
      "ry": 0.0,
      "rz": 0.0001817679719013731
     }
    },
    {
     "node_id": "4",
     "components": {
      "dx": 0.0018852556423795477,
      "dy": 0.0024758856183176347,
      "dz": 0.0,
      "rx": 0.0,
      "ry": 0.0,
      "rz": 0.0001815834615887411
     }
    },
    {
     "node_id": "5",
     "components": {
      "dx": 0.001404668417622022,
      "dy": 0.0024746554654216345,
      "dz": 0.0,
      "rx": 0.0,
      "ry": 0.0,
      "rz": 0.00018112387785090112
     }
    },
    {
     "node_id": "6",
     "components": {
      "dx": 0.0003318521622013393,
      "dy": 0.0024711980085880348,
      "dz": 0.0,
      "rx": 0.0,
      "ry": 0.0,
      "rz": 0.0001800937165668371
     }
    },
    {
     "node_id": "7",
     "components": {
      "dx": 0.000330125512697633,
      "dy": 0.0024710321185280344,
      "dz": 0.0,
      "rx": 0.0,
      "ry": 0.0,
      "rz": 0.00016523618417441652
     }
    },
    {
     "node_id": "8",
     "components": {
      "dx": 0.0001649760424360165,
      "dy": 0.0024703685582880344,
      "dz": 0.0,
      "rx": 0.0,
      "ry": 0.0,
      "rz": 0.0001650627563488165
     }
    },
    {
     "node_id": "9",
     "components": {
      "dx": 3.0659400936663954e-23,
      "dy": 0.0024695027644480345,
      "dz": 0.0,
      "rx": 0.0,
      "ry": 0.0,
      "rz": 0.0001648893285232165
     }
    }
   ],
   "support_reactions": [
    {
     "node_id": "9",
     "components": {
      "fx": 9.51144718541741e-12,
      "fy": -21644.84599999697,
      "fz": 0.0,
      "mx": 0.0,
      "my": 0.0,
      "mz": -4335.695639999814
     }
    }
   ],
   "member_section_forces": [
    {
     "member_id": "1",
     "segments": [
      {
       "segment_id": "S0-S1",
       "station_i": "S0",
       "station_j": "S1",
       "length": 1.4000000000000004,
       "i_end": {
        "fx": -6800.0,
        "fy": 0.0,
        "fz": 0.0,
        "mx": -0.0,
        "my": -0.0,
        "mz": 816.0
       },
       "j_end": {
        "fx": -7905.356,
        "fy": -0.0,
        "fz": -0.0,
        "mx": 0.0,
        "my": 0.0,
        "mz": 816.0
       }
      }
     ]
    },
    {
     "member_id": "2",
     "segments": [
      {
       "segment_id": "S0-S1",
       "station_i": "S0",
       "station_j": "S1",
       "length": 0.69,
       "i_end": {
        "fx": -0.0,
        "fy": -7905.356,
        "fz": 0.0,
        "mx": -0.0,
        "my": -0.0,
        "mz": -6270.695639999999
       },
       "j_end": {
        "fx": 0.0,
        "fy": -7905.356,
        "fz": -0.0,
        "mx": 0.0,
        "my": 0.0,
        "mz": -816.0
       }
      }
     ]
    },
    {
     "member_id": "3",
     "segments": [
      {
       "segment_id": "S0-S1",
       "station_i": "S0",
       "station_j": "S1",
       "length": 0.5,
       "i_end": {
        "fx": -10353.266,
        "fy": 0.0,
        "fz": 0.0,
        "mx": -0.0,